{
  "schemaVersion": "1.0.0",
  "generatedFrom": "92b5e741947a73dc95f673adc8ff2431b7615aa1",
  "categories": [
    "on-chain",
    "off-chain",
    "agent",
    "web-ui",
    "cli"
  ],
  "onChain": [
    "named WorkStream",
    "claimable WorkStream",
    "public WorkStream",
    "StreamRegistry",
    "USDC",
    "EIP-712 attestation and payee binding",
    "contract events"
  ],
  "offChain": [
    "GitHub webhook and diff evidence",
    "JSONL agent logs",
    "Circle Gateway and x402 payment"
  ],
  "agent": [
    "attestor pipeline",
    "independent verifier review",
    "sandboxed correctness evidence",
    "public earner resolution and binding",
    "metering",
    "reconciliation"
  ],
  "webUi": [
    "Next.js App Router pages",
    "named, claimable, and public stream flows",
    "viem readers and writers",
    "wallet and passkey paths"
  ],
  "cli": [
    "agent:dev",
    "check:chain",
    "circle:setup",
    "evidence",
    "gateway:deposit",
    "logs:pull",
    "preflight:agent",
    "preflight:deploy",
    "preflight:drain",
    "preflight:register",
    "preflight:verifier",
    "preflight:withdraw",
    "probe:policy",
    "revert:prepare",
    "review:test",
    "sandbox:smoke",
    "seed",
    "skill:check",
    "skill:creative-check",
    "skill:generate",
    "skill:install-test",
    "skill:pack",
    "skill:release-dry-run",
    "skill:test",
    "stream:status",
    "sweep",
    "sync:artifacts",
    "test:ago",
    "test:allowlist",
    "test:amounts",
    "test:bind",
    "test:caps",
    "test:ceiling",
    "test:correctness",
    "test:create-stream",
    "test:earner",
    "test:failover",
    "test:json",
    "test:metering",
    "test:poll",
    "test:reconcile",
    "test:repo",
    "test:resume",
    "test:sandbox",
    "test:serialize",
    "test:suite-cache",
    "test:sweep",
    "test:withdraw-cap",
    "verdict:test",
    "verifier:dev",
    "verify:once",
    "watch",
    "web:build",
    "web:dev",
    "webhook:secret",
    "withdraw"
  ],
  "absent": [
    "public SDK",
    "stable REST API",
    "hosted webhook delivery service",
    "MCP server"
  ]
}
